{
  "domain": "film-submission-review",
  "version": 1,
  "sample_id": "092201-009",
  "record_types": [
    "影片报名",
    "媒体版本",
    "权利声明",
    "补件记录",
    "评委评分",
    "审定结果"
  ],
  "workflow_states": [
    "已报名",
    "待补件",
    "可评审",
    "评审中",
    "已撤回",
    "已审定"
  ],
  "facts": [
    "电影节收到大量国家和地区的影片报名",
    "活动包含金丝路奖评选",
    "主宾国机制带来更多跨国电影合作"
  ],
  "sample": {
    "film": "丝路短片样例",
    "countries": [
      "中国",
      "埃及"
    ],
    "runtime_minutes": 24,
    "subtitle_languages": [
      "中文",
      "阿拉伯语"
    ]
  }
}
